{
  "$schema": "https://json-schema.org/draft/2020-12/schema",
  "$id": "https://mncs.dev/schema/mncds/0.2/mncds-obligation-record.schema.json",
  "title": "MNCDS 0.2 development obligation record",
  "description": "Machine-readable development obligation owned by MNCDS. Pressure discovered during family execution is projected into this form (see docs/obligation-projection.md) so it enters the same lifecycle as ChangeSet work: open -> resolved/rejected, evaluated at the MNCS promotion boundary. An obligation record is a process claim, never a conformity verdict.",
  "type": "object",
  "additionalProperties": false,
  "required": [
    "schema_version",
    "obligation_key",
    "status",
    "required",
    "subject",
    "origin",
    "evidence",
    "extensions"
  ],
  "properties": {
    "schema_version": {"const": "mncds-obligation-record/0.2"},
    "obligation_key": {
      "type": "string",
      "minLength": 1,
      "description": "Stable identity for this obligation; duplicates within one evaluation set are contradictory."
    },
    "status": {"enum": ["open", "resolved", "rejected"]},
    "required": {
      "type": "boolean",
      "description": "Whether an open obligation blocks promotion evaluation. Optional open obligations stay visible but do not decide."
    },
    "subject": {
      "type": "object",
      "additionalProperties": false,
      "required": ["repository", "commit"],
      "properties": {
        "repository": {"type": "string", "minLength": 1},
        "commit": {
          "type": "string",
          "pattern": "^[0-9a-f]{40}$",
          "description": "Exact candidate commit this obligation was raised against. An obligation never promotes a different revision."
        }
      }
    },
    "origin": {
      "type": "object",
      "additionalProperties": false,
      "required": ["kind", "authority"],
      "properties": {
        "kind": {
          "enum": ["development-pressure", "changeset", "manual", "evaluation-gap"],
          "description": "Where the obligation came from. evaluation-gap marks missing authority semantics (UNKNOWN by construction)."
        },
        "authority": {"type": "string", "minLength": 1},
        "pressure_id": {"type": "string", "minLength": 1},
        "changeset_id": {"type": "string", "minLength": 1},
        "record_id": {"type": "string", "minLength": 1}
      }
    },
    "resolution": {
      "type": "object",
      "additionalProperties": false,
      "required": ["resolution", "evidence_refs", "resolved_by", "resolved_at"],
      "properties": {
        "resolution": {"enum": ["fixed", "rejected"]},
        "evidence_refs": {
          "type": "array",
          "minItems": 1,
          "items": {"type": "string", "minLength": 1}
        },
        "resolved_by": {"type": "string", "minLength": 1},
        "resolved_at": {"type": "string", "format": "date-time"}
      },
      "description": "Present when status is resolved or rejected. resolved requires resolution fixed with resolver identity; rejected requires resolution rejected. Tolerance is granted by boundary policy at evaluation time, never recorded here."
    },
    "evidence": {
      "type": "array",
      "items": {"type": "string", "minLength": 1},
      "description": "Evidence references (digests, paths, URIs) supporting the current status."
    },
    "supersedes": {
      "oneOf": [{"type": "null"}, {"type": "string", "minLength": 1}],
      "description": "Previous obligation_key this record replaces; convergent pressures link, never silently merge."
    },
    "extensions": {
      "type": "object",
      "description": "Namespaced owner extensions; transport must ignore unknown keys."
    }
  },
  "allOf": [
    {
      "if": {"properties": {"status": {"enum": ["resolved", "rejected"]}}},
      "then": {"required": ["resolution"]}
    },
    {
      "if": {"properties": {"status": {"const": "open"}}},
      "then": {"properties": {"resolution": false}}
    },
    {
      "if": {"properties": {"status": {"const": "resolved"}}},
      "then": {"properties": {"resolution": {"properties": {"resolution": {"const": "fixed"}}}}}
    },
    {
      "if": {"properties": {"status": {"const": "rejected"}}},
      "then": {"properties": {"resolution": {"properties": {"resolution": {"const": "rejected"}}}}}
    }
  ]
}
